LAB CYCLE 2
EXPERIMENT NO: 1
DATE: 14/02/2021

		AIM:  1. Create a database ‘Company’ with the following tables: 
Table Name: Department 
Attributes 	Datatype 	Constraints 
Deptid 	integer 	Primary Key
Deptname 	Varchar2 	Not Null, Unique

Table Name: Employees 
Attributes 	Datatype 	Constraints 
Empid 	integer 	Primary Key
Ename 	Varchar2 	Not Null
Deptid 	integer 	Foreign Key reference to the column  ‘Deptid’ of the table Department, on  delete cascade, on update cascade

SQL Query:

create database Company;
use Company;
create table Department(Deptid Integer Primary Key,Deptname varchar(10) not null unique);
create table Employees(Empid Integer Primary Key,Ename varchar(20) not null,Deptid Integer,foreign key(Deptid) references Department(Deptid) on delete cascade on update cascade);

SAMPLE OUTPUT

MariaDB [(none)]> show databases;
+--------------------+
| Database           |
+--------------------+
| company            |
| information_schema |
| ktym_taluk         |
       |
| mysql              |
| own                |
| performance_schema |
| phpmyadmin         |
| test               |
+--------------------+
8 rows in set (0.001 sec)


MariaDB [Company]> show tables;
+-------------------+
| Tables_in_company |
+-------------------+
| department        |
| employees         |
+-------------------+
2 rows in set (0.001 sec)

MariaDB [Company]> desc Department;
+----------+-------------+------+-----+---------+-------+
| Field    | Type        | Null | Key | Default | Extra |
+----------+-------------+------+-----+---------+-------+
| Deptid   | int(11)     | NO   | PRI | NULL    |       |
| Deptname | varchar(10) | NO   | UNI | NULL    |       |
+----------+-------------+------+-----+---------+-------+
2 rows in set (0.059 sec)

MariaDB [Company]> desc Employees;
+--------+-------------+------+-----+---------+-------+
| Field  | Type        | Null | Key | Default | Extra |
+--------+-------------+------+-----+---------+-------+
| Empid  | int(11)     | NO   | PRI | NULL    |       |
| Ename  | varchar(20) | NO   |     | NULL    |       |
| Deptid | int(11)     | YES  | MUL | NULL    |       |
+--------+-------------+------+-----+---------+-------+
3	rows in set (0.065 sec)


	Add an attribute ‘emailid’ of data type ‘varchar’ with size 40, salary of data type  integer and remarks of data type varchar with size 45 to the Employee Table.

SQL Query:

alter table Employees add emailid varchar(40),add salary integer,add remarks varchar(45);

SAMPLE OUTPUT

MariaDB [Company]> desc Employees;
+---------+-------------+------+-----+---------+-------+
| Field   | Type        | Null | Key | Default | Extra |
+---------+-------------+------+-----+---------+-------+
| Empid   | int(11)     | NO   | PRI | NULL    |       |
| Ename   | varchar(20) | NO   |     | NULL    |       |
| Deptid  | int(11)     | YES  | MUL | NULL    |       |

| emailid | varchar(40) | YES  |     | NULL    |       |
| salary  | int(11)     | YES  |     | NULL    |       |
| remarks | varchar(45) | YES  |     | NULL    |       |
+---------+-------------+------+-----+---------+-------+
6 rows in set (0.050 sec)



	Add unique constraint to the attribute ‘emailid’.

SQL Query:

alter table Employees add unique(emailid);


SAMPLE OUTPUT

MariaDB [Company]> desc Employees;
+---------+-------------+------+-----+---------+-------+
| Field   | Type        | Null | Key | Default | Extra |
+---------+-------------+------+-----+---------+-------+
| Empid   | int(11)     | NO   | PRI | NULL    |       |
| Ename   | varchar(20) | NO   |     | NULL    |       |
| Deptid  | int(11)     | YES  | MUL | NULL    |       |
| emailid | varchar(40) | YES  | UNI | NULL    |       |
| salary  | int(11)     | YES  |     | NULL    |       |
| remarks | varchar(45) | YES  |     | NULL    |       |
+---------+-------------+------+-----+---------+-------+
5 rows in set (0.069 sec)


	Add an attribute salary of data type integer with a constraint that salary never falls  below 5000. 

SQL Query:

alter table Employees add constraint salary_check check (salary>=5000);


SAMPLE OUTPUT

MariaDB [Company]> desc Employees;
+---------+-------------+------+-----+---------+-------+
| Field   | Type        | Null | Key | Default | Extra |
+---------+-------------+------+-----+---------+-------+
| Empid   | int(11)     | NO   | PRI | NULL    |       |
| Ename   | varchar(20) | NO   |     | NULL    |       |
| Deptid  | int(11)     | YES  | MUL | NULL    |       |
| emailid | varchar(40) | YES  | UNI | NULL    |       |
| salary  | int(11)     | YES  |     | NULL    |       |
| remarks | varchar(45) | YES  |     | NULL    |       |
+---------+-------------+------+-----+---------+-------+
5 rows in set (0.069 sec)

	Drop ‘remarks’ attribute from the table Employee.

SQL Query:

alter table Employees drop column remarks;

SAMPLE OUTPUT

MariaDB [Company]> desc Employees;
+---------+-------------+------+-----+---------+-------+
| Field   | Type        | Null | Key | Default | Extra |
+---------+-------------+------+-----+---------+-------+
| Empid   | int(11)     | NO   | PRI | NULL    |       |
| Ename   | varchar(20) | NO   |     | NULL    |       |
| Deptid  | int(11)     | YES  | MUL | NULL    |       |
| emailid | varchar(40) | YES  | UNI | NULL    |       |
| salary  | int(11)     | YES  |     | NULL    |       |
+---------+-------------+------+-----+---------+-------+
5 rows in set (0.069 sec)


	Describe the Department and Employee tables. 

SQL Query:

desc Employees;
desc Department;

SAMPLE OUTPUT

MariaDB [Company]> desc Employees;
+---------+-------------+------+-----+---------+-------+
| Field   | Type        | Null | Key | Default | Extra |
+---------+-------------+------+-----+---------+-------+
| Empid   | int(11)     | NO   | PRI | NULL    |       |
| Ename   | varchar(20) | NO   |     | NULL    |       |
| Deptid  | int(11)     | YES  | MUL | NULL    |       |
| emailid | varchar(40) | YES  | UNI | NULL    |       |
| salary  | int(11)     | YES  |     | NULL    |       |
+---------+-------------+------+-----+---------+-------+
5 rows in set (0.069 sec)

MariaDB [Company]> desc Department;
+----------+-------------+------+-----+---------+-------+
| Field    | Type        | Null | Key | Default | Extra |
+----------+-------------+------+-----+---------+-------+
| Deptid   | int(11)     | NO   | PRI | NULL    |       |
| Deptname | varchar(10) | NO   | UNI | NULL    |       |
+----------+-------------+------+-----+---------+-------+
2 rows in set (0.065 sec)


	Insert at least 5 tuples to Department and Employee tables.

SQL Query:

insert into Department values(101,'Production'),(102,'Sales'),(103,'Marketing'),(104,'Testing'),(201,'Maintenance');

insert into Employees values(1221,'Anju',104,'anju@gmail.com',7000),(1224,'Anna',103,'anna@gmail.com',5000),(1331,'Aadhi',201,'aadhi@gmail.com',13000),(1441,'Lilly',101,'lilly@gmail.com',6000),(1551,'Zara',102,'zara@gmail.com',8000);


SAMPLE OUTPUT


MariaDB [Company]> select * from Department;
+--------+------------+
| Deptid | Deptname   |
+--------+------------+
|    201 | Maintenanc |
|    103 | Marketing  |
|    101 | Production |
|    102 | Sales      |
|    104 | Testing    |
+--------+------------+
5 rows in set (0.006 sec)

MariaDB [Company]> select * from Employees;
+-------+-------+--------+-----------------+--------+
| Empid | Ename | Deptid | emailid         | salary |
+-------+-------+--------+-----------------+--------+
|  1221 | Anju  |    104 | anju@gmail.com  |   7000 |
|  1224 | Anna  |    103 | anna@gmail.com  |   5000 |
|  1331 | Aadhi |    201 | aadhi@gmail.com |  13000 |
|  1441 | Lilly |    101 | lilly@gmail.com |   6000 |
|  1551 | Zara  |    102 | zara@gmail.com  |   8000 |
+-------+-------+--------+-----------------+--------+
5 rows in set (0.001 sec)

	Retrieve the entire contents of the Department and Employee tables.

SQL Query:

select * from Department;
select * from Employees;


SAMPLE OUTPUT

MariaDB [Company]> select * from Department;
+--------+------------+
| Deptid | Deptname   |
+--------+------------+

|    201 | Maintenanc |
|    103 | Marketing  |
|    101 | Production |
|    102 | Sales      |
|    104 | Testing    |
+--------+------------+
5 rows in set (0.006 sec)

MariaDB [Company]> select * from Employees;
+-------+-------+--------+-----------------+--------+
| Empid | Ename | Deptid | emailid         | salary |
+-------+-------+--------+-----------------+--------+
|  1221 | Anju  |    104 | anju@gmail.com  |   7000 |
|  1224 | Anna  |    103 | anna@gmail.com  |   5000 |
|  1331 | Aadhi |    201 | aadhi@gmail.com |  13000 |
|  1441 | Lilly |    101 | lilly@gmail.com |   6000 |
|  1551 | Zara  |    102 | zara@gmail.com  |   8000 |
+-------+-------+--------+-----------------+--------+
5 rows in set (0.001 sec)



	Find out the name of the Employees in the Department with Deptid 101.

SQL Query:

select Ename from employees where Deptid=101;

SAMPLE OUTPUT

MariaDB [Company]> select Ename from employees where Deptid=101;
+-------+
| Ename |
+-------+
| Lilly |
+-------+
1 row in set (0.007 sec)



	Display the name and salary of all Employees.

SQL Query:

select Ename,salary from Employees;



SAMPLE OUTPUT

MariaDB [Company]> select Ename,salary from Employees;
+-------+--------+
| Ename | salary |
+-------+--------+

| Anju  |   7000 |
| Anna  |   5000 |
| Aadhi |  13000 |
| Lilly |   6000 |
| Zara  |   8000 |
+-------+--------+
5 rows in set (0.000 sec)


	Update the salary of the employee with employee id ‘1221’ to Rs. 50000.

SQL Query:

update Employees set salary=50000 where EmpId=1221;

SAMPLE OUTPUT

MariaDB [Company]> select * from Employees;
+-------+-------+--------+-----------------+--------+
| Empid | Ename | Deptid | emailid         | salary |
+-------+-------+--------+-----------------+--------+
|  1221 | Anju  |    104 | anju@gmail.com  |  50000 |
|  1224 | Anna  |    103 | anna@gmail.com  |   5000 |
|  1331 | Aadhi |    201 | aadhi@gmail.com |  13000 |
|  1441 | Lilly |    101 | lilly@gmail.com |   6000 |
|  1551 | Zara  |    102 | zara@gmail.com  |   8000 |
+-------+-------+--------+-----------------+--------+
5 rows in set (0.000 sec)



	Delete the details of employee with employee id ‘1331’.


SQL Query:

delete from Employees where Empid=1331;


SAMPLE OUTPUT

MariaDB [Company]> select * from Employees;
+-------+-------+--------+-----------------+--------+
| Empid | Ename | Deptid | emailid         | salary |
+-------+-------+--------+-----------------+--------+
|  1221 | Anju  |    104 | anju@gmail.com  |  50000 |
|  1224 | Anna  |    103 | anna@gmail.com  |   5000 |
|  1441 | Lilly |    101 | lilly@gmail.com |   6000 |

|  1551 | Zara  |    102 | zara@gmail.com  |   8000 |
+-------+-------+--------+-----------------+--------+
4 rows in set (0.000 sec)




	Find the name of employees who has a salary equal to Rs.13000. 


SQL Query:

MariaDB [Company]> select Ename from Employees where salary=13000;

SAMPLE OUTPUT

+-------+
| Ename |
+-------+
| Aadhi |
+-------+
1 row in set (0.007 sec)



	Delete the department with Deptid ’201’


SQL Query:

delete from Department where Deptid=201;

SAMPLE OUTPUT

MariaDB [Company]> select * from Department;
+--------+------------+
| Deptid | Deptname   |
+--------+------------+
|    103 | Marketing  |
|    101 | Production |
|    102 | Sales      |
|    104 | Testing    |
+--------+------------+
4 rows in set (0.000 sec)



	Display the details of employees in the ascending order of their salary.

SQL Query:

select * from Employees order by salary asc;










SAMPLE OUTPUT

+-------+-------+--------+-----------------+--------+
| Empid | Ename | Deptid | emailid         | salary |
+-------+-------+--------+-----------------+--------+

|  1224 | Anna  |    103 | anna@gmail.com  |   5000 |
|  1441 | Lilly |    101 | lilly@gmail.com |   6000 |
|  1551 | Zara  |    102 | zara@gmail.com  |   8000 |
|  1221 | Anju  |    104 | anju@gmail.com  |  50000 |
+-------+-------+--------+-----------------+--------+
4 rows in set (0.005 sec)



